Key,Id,English(en),Japanese (Japan)(ja-JP),Chinese (Traditional)(zh-TW)
demo.red.t,1.44377E+12,"10... 62... No, it's just a coincidence. Yeah, no one knows I lived at 1062 Exwlston Street, a place where birds don't lay eggs.",10 ... 62 ... い や 、 偶 然 だ よ 。 そ う 、 誰 も 私 が 1 0 6 2 エ ク ス ウ ル ス ト ン ス ト リ ー ト に 住 ん で い た こ と を 知 ら な い 、 鳥 が 卵 を 産 ま な い 場 所 。,10 ⋯ ⋯ 62 ， 不 ， 這 只 是 巧 合 ， 對 ， 沒 人 知 道 我 曾 住 在 1 0 6 2 Exwlston 　 Street 這 種 鳥 不 生 蛋 的 地 方 。
demo.blue.t,1.63755E+12,"Damn, does 0835 mean something too? No... why am I thinking like this?",く そ っ 、 0 8 3 5 も 何 か 意 味 が あ る の か ？ い や ... ど う し て こ ん な 考 え に な っ て し ま っ た ん だ ろ う 。,該 死 ， 0 8 3 5 也 代 表 什 麼 嗎 ？ 不 ⋯ ⋯ 我 怎 麼 會 有 這 種 想 法 。
demo.green.t,1.71103E+12,The puzzle of the flipped dot matrix was developed by me nine years ago in six different modes. It appeared in episodes 4 and 7 of ROOM. Why am I still thinking about it after all this time?,反 転 ド ッ ト マ ト リ ッ ク ス の パ ズ ル は 私 が 9 年 前 に 6 つ の 異 な る モ ー ド で 開 発 し た も の で す 。 R O O M の 第 4 話 と 第 7 話 に 登 場 し ま し た 。 な ぜ こ ん な に 長 い 間 考 え て い る の で し ょ う か ？,翻 轉 點 陣 圖 的 謎 題 早 在 6 年 前 被 我 開 發 出 來 九 種 模 式 ， 在 R O O M 播 出 的 第 4 和 7 集 都 出 現 過 ， 我 怎 麼 還 會 想 這 麼 久 ？
demo.door.t,6.41027E+12,What are those dots of light? Floating dust? A hallucination in my mind?,あ の 光 の 点 々 は 何 で す か ？ 浮 遊 す る ほ こ り ？ 私 の 頭 の 中 の 幻 覚 ？,那 些 光 點 是 什 麼 ？ 懸 浮 的 灰 塵 嗎 ？ 我 腦 中 的 幻 覺 ？
book_room.bookshief.t,10221460544651264,,,嗯 ⋯ ⋯ A - Z 啊 ， 分 類 的 還 算 有 水 準 ， 但 當 成 機 關 嘛 ⋯ ⋯
